name,price
"Pâtes italiennes torciglioni n°1 U, 500g ",1.31
"Coudes rayés qualité supérieure U, sachet de 1kg ",1.12
"Pates torsade qualité supérieure U, paquet de 1kg ",0.87
"Coquillette cuisson rapide U, sachet de 500g ",0.5
"Spaghetti qualité supérieure U, sachet cello de 1kg ",0.72
"Macaroni qualité supérieure U, sachet de 1kg ",0.8
"Coudes rayés qualité supérieure U, paquet cello de 500g ",0.67
"Torsade cuisson rapide U, sachet de 500g ",0.49
"Macaroni qualité supérieure U, paquet cello de 500g ",0.41
"Pâtes italiennes fusilli n°6 U, paquet de 500g ",1.31
"Torsade qualité supérieure U, paquet cello de 500g ",0.48
"Coquillette qualité supérieure U, paquet cello de 500g ",0.41
"Pâtes Italiennes linguinei n°9 U, paquet de 500g ",1.31
"Spaghetti qualité supérieure U, paquet cello de 500g ",0.41
"Coquillettes qualité supérieure U, sachet de 1kg ",0.78
"Spaghettini n°3 BARILLA, 500g ",1.13
"Macaroni PANZANI, paquet de 500g ",0.75
"Spaghettoni n°7 BARILLA, 500g ",
"Spaghetti n°5 sans gluten BARILLA, boite de 400g ",1.31
"Torti PANZANI, paquet de 500g ",1.12
Macaroni qualité supérieure BARILLA étui 500g ,0.87
"Coudes rayés PANZANI,paquet de 500g ",0.5
"Spaghetti PANZANI, paquet de 500g ",0.72
"Torsades BARILLA, étui de 500g ",0.8
"Coquillettes BARILLA, 1kg ",0.67
"Spaghetti 11 minutes academia BARILLA, 500g ",0.49
"Spaghetti n°5 qualité supérieure BARILLA, étui de 500g ",0.41
"Coquillettes BARILLA, étui de 500g ",1.31
"Fusilli PANZANI, 500g ",0.48
"Tagliatelles n°16 BARILLA,boîte de 500g ",0.41
"Spaghetti n°12 DE CECCO, paquet de 500g ",1.31
"Fusilli 8 minutes academia BARILLA, 500g ",0.41
"Pipe rigate BARILLA, boîte de 500g ",0.78
"Pâtes créatives pipe rigate PANZANI, sachet de 500g ",1.13
"Coquillettes cuisson rapide PANZANI, 500g ",0.75
"Pâtes spaghetti cuisson rapide PANZANI, 500g ",
"Mini farfalle piccolini BARILLA, paquet de 500g ",1.67
"Farfalle qualité supérieure U, sachet de 1kg ",0.74
"Penne Rigate qualité supérieure U, sachet de 1kg ",0.9
"Farfalle qualité supérieure cello U, 500g ",0.91
"Penne qualité supérieure cello U, 500g ",0.73
Capellini Numéro 1 BARILLA étui 500g ,0.83
"Farfalline BARILLA, 500g ",
"Pâtes fantaisie Capellini PANZANI, sachet de 500g ",
"Fusilli BARILLA, étui de 500g ",0.8
"Penne rigate BARILLA, 1kg ",
"Pâtes collez castellane BARILLA, 500g ",1.03
"Pâtes créatives tortiglioni PANZANI, sachet de 500g ",
"Orecchiette La Collezione BARILLA, 500g ",1.52
"Fusilli n°34 DE CECCO, 500g ",
"Linguine n°7 DE CECCO, paquet de 500g ",0.85
"Penne Rigate BARILLA, paquet de 500g ",
"Pâtes créatives linguine PANZANI, sachet de 500g ",1.0
"Penne rigate sans gluten BARILLA, boite de 400g ",0.99
"Pâtes fantaisies Penne Rigate PANZANI, sachet de 500g ",
"Linguine 8 minutes academia BARILLA, 500g ",0.92
"Pâtes penne rigate cuisson rapide PANZANI, sachet de 500g ",0.99
"Linguine La Collezione BARILLA, 500g ",0.63
"Pâtes Tofarelle academia BARILLA, 500g ",0.6
"Penne Rigate n°41 DE CECCO, paquet de 500g ",0.83
"Tagliatelles Fantaisie PANZANI, paquet de 500g ",
"Pâtes fantaisies Serpentini PANZANI, sachet de 500g ",0.82
"Petits nids IGP d'Alsace aux oeufs U, sachet de 250g ",0.96
"Tagliatelles IGP d'Alsace aux oeufs U, sachet de 250g ",
"Coquillettes IGP d'Alsace aux oeufs U, sachet de 250g ",1.15
"Torsades IGP d'Alsace aux oeufs U, sachet de 250g ",
"Spaghetti aux oeufs IGP d'Alsace U, sachet de 250g ",
"Papillons aux oeufs IGP d'Alsace U, sachet de 250g ",1.47
"Pâtes aux oeufs macaroni IGP d'Alsace U, sachet de 250g ",1.61
"Penne aux oeufs rigate IGP d'Alsace U, sachet de 250g ",0.83
"Macaronis coupés IGP VALFLEURI, paquet de 250g ",
"Spirales aux oeufs GRAND'MERE, sachet de 250g ",1.67
"Mini'pat torsades bio cuisson rapide BIO VALFLEURI, 400g ",0.79
"Coquilles d'Alsace aux oeufs GRAND'MERE, sachet de 250g ",1.97
"Torsades BIO sans gluten GRAND'MERE, sachet de 250g ",1.27
"Nids n°4 GRAND'MERE, sachet de 250g ",0.96
"Papillons GRAND'MERE, sachet de 250g ",
"Macaroni coupés IGP GRAND'MERE, sachet de 250g ",1.44
"Penne IGP VALFLEURI, paquet de 250g ",1.24
"Petits coudes aux oeufs GRAND'MERE, sachet de 250g ",0.8
"Mini'pat coquillettes bio cuisson rapide BIO VALFLEURI, 400g ",1.07
"Spaghetti BIO sans gluten GRAND'MERE, sachet de 250g ",1.07
"Coquillette d'Alsace aux oeufs IGP VALFLEURI, paquet de 250g ",1.02
"Torsades GRAND'MERE, sachet de 250g ",1.01
"Macaronis longs aux oeufs GRAND'MERE, sachet de 250g ",1.07
Tendr'épices Bio torsades pois cassés VALFLEURI sachet 250g ,1.07
"Spaghetti d'Alsace aux oeufs GRAND'MERE, paquet de 250g ",
"Nids d'Alsace n°2 GRAND'MERE, sachet de 250g ",1.11
"Spaghetti IGP VALFLEURI, paquet de 250g ",1.2
"Pâtes d'Alsace Nids n°4 IGP GRAND'MERE, sachet de 500g ",1.09
"Coquillettes d'Alsace aux oeufs GRAND'MERE, sachet de 250g ",2.01
"Spaghetti longs aux oeufs LUSTUCRU, paquet de 250g ",
"Penne BIO sans gluten GRAND'MERE, sachet de 250g ",1.89
"Torsades IGP VALFLEURI, paquet de 250g ",1.05
"Spaghetti aux oeufs IGP VALFLEURI, paquet de 500g ",1.07
"Penne aux oeufs GRAND'MERE, sachet de 250g ",1.07
"Gros coudes IGP VALFLEURI, paquet de 250g ",1.15
"Coquillettes aux oeufs LUSTUCRU, 250g ",
Tendr'épices Bio torsades lentilles corail VALFLEURI 250g ,2.01
"Lasagnette IGP pâtes d'Alsace VALFLEURI, paquet de 250g ",1.91
"Späetzle GRAND'MERE, sachet de 500g ",
"Spaetzle GRAND'MERE, sachet de 250g ",1.05
"Tagliatelles aux oeufs La Collezione BARILLA, 500g ",1.07
"Nids cuisson 2mm IGP VALFLEURI, paquet de 250g ",2.52
"Nuddle laminées à l'ancienne cuisson 5min VALFLEURI, paquet de 500g ",1.05
"Nids cuisson 5mn IGP VALFLEURIS, paquet de 250g ",1.07
"Lasagnes qualité supérieure U, boîte de 500g ",1.15
"Cannelloni à garnir PANZANI, 250g ",1.97
"Pâtes Conchiglie 5 couleurs U SAVEURS, sachet de 500g ",1.05
"Penne de lentilles corail BARILLA, paquet de 250g ",0.95
"Torsades complètes U BIO, paquet de 500g ",
"Torsades au blé complet U, sachet de 500g ",1.19
"Spaghetti bio  U, paquet de  500g ",2.3
"Farfalles U BIO, paquet de 500g ",1.06
"Pennes complètes U BIO, boîte en carton de 500g ",1.2
"Spaghetti bio BARILLA, 500g ",0.85
"Pennette rigatte au blé complet Intégrali BARILLA, 500g ",2.52
"Penne rigate bio BARILLA, 500g ",1.15
"Coquillettes au blé complet Intégrali BARILLA, 500g ",1.94
"Fusilli bio BARILLA, étui de 500g ",1.05
Spaghetti au blé complet Intégrali BARILLA étui 500g ,
"Vermicelle qualité supérieure U, sachet de 500g ",1.18
"Pates cheveux d'ange IGP d'Alsace aux oeufs U, sachet 250g ",2.26
"Vermicelles PANZANI, 500g ",1.17
"Pâtes Alphabet aux oeufs GRAND'MERE, 250g ",
"Riz long étuvé 10 minutes vrac U, étui de 500g ",
"Riz long grain étuvé 10 minutes U, étui vrac de 1kg ",1.71
"Riz 10min étuvé LUSTUCRU, étui de 900g ",
"Riz UNCLE BEN'S, 1kg ",1.11
"Riz long grain étuvé 10 minutes U, étui de 5 sachets cuisson, 200g ",
"Riz long grain étuvé 10 minutes U, 4 sachets cuisson de 125g, 500g ",1.01
"Riz long grain cuisson rapide 10 minutes UNCLE BEN'S, 5x200g ",1.32
"Riz 10min étuvé LUSTUCRU, sachet cuisson de 900g ",1.01
"Riz long spécial risotto DONATI, 1kg ",
"Riz long pigino, 1kg ",1.15
"Riz long thaï U, sachet carré en aluminium de 1kg ",
"Riz long basmati U, paquet aluminisé de 500g ",
"Mélange de riz basmati et sauvage 15 minutes U, étui de 500g ",
"Riz basmati du Penjab TAUREAU AILE, étui de 1kg ",0.93
"Riz carnaroli RISO GALLO, paquet de 500g ",0.5
"Riz thaï du plateau de l'is-an TAUREAU AILE, paquet de 1kg ",1.11
"Riz long IGP méditerranée TAUREAU AILE, étui de 1kg ",
"Riz thaï du plateau de l'is-an TAUREAU AILE, étui de 500g ",1.08
"Riz pour risotto crémeux & savoureux 15-18mn TAUREAU AILE, 500g ",0.87
"Risotto pronto aux cèpes RISO GALLO, boîte 210g ",
"Riz pour risotto gran RISO GALLO, boîte de 500g ",
"Riz Kamalis TAUREAU AILE, étui de 500g ",
"Riz basmati penjab long grain naturellement parfumé TAUREAU AILE, sachet de 600g ",
"Le riz parfumé le délicat 11 minutes TAUREAU AILE, paquet 500g ",0.81
"Riz long parfumé Pigino, 1kg ",2.45
"Riz basmati U, 5x200g ",
"Riz long Thai U, 4 sachets cuisson de 125g, 500g ",2.52
"Riz basmati UNCLE BEN'S, 4 sachet cuisson, 500g ",0.79
"Riz complet U, étui de 500g ",
"Riz basmati complet U BIO, 500g ",
"Riz long semi-complet étuvé 10 minutes U BIO, paquet de 500g ",1.94
"Riz thaï Bio U, 500g ",
"Riz thaï bio TAUREAU AILE, sachet de 500g ",2.87
"Chips paysanne nature U, paquet de 150g ",2.89
"Chips à l'ancienne saveur moutarde U, paquet de 135g ",
"Chips vitelottes U SAVEURS, sachet de 125g ",2.13
"Chips de légumes U SAVEURS, paquet de 100g ",1.74
"Chips à l'ancienne saveur crème et oignon U, paquet de 135g ",2.16
"Chips nature U, 1 sachet 150g ",2.33
"Chips à l'ancienne nature U, 6 sachets de 30g ",2.41
"Chips saveur barbecue U, paquet de 135g ",2.81
"Chips à l'ancienne nature U, sachet de 150g ",1.84
"Chips arome (ketchup/moutarde/barbecue) U, 6x30g ",1.56
"Chips nature multipack U, 6x30g easypack ",1.98
"Chips ondulées easy U, 6x30g ",1.45
"Chips ondulées U BIO, sachet de 125g ",1.98
"Chips nature bio U BIO, sachet de 125g ",1.15
"Chips saveur poulet thym roti LAY'S , sachet de 130g ",
"Chips saveur barbecue LAY'S, sachet de 130g ",
"Chips paysannes nature LAY'S, 6x27, 5g ",1.84
"Chips finement salées LAY'S, 6x25g ",
"Chips saveur barbecue LAY'S, sachet de 240g ",1.04
"Chips saveur spicy LAY'S, sachet de 130g ",1.18
"Chips extra craquantes nature pomme de terre salées ondulées VICO, 135g ",
"Chips cuites au four LAY'S, 130g ",
"Chips paysannes LAY'S, sachet de 300g ",
"Chips saveur fromage LAY'S, 130g ",0.81
"Chips de pommes de terre ondulées saveur fromage BRET'S, sachet de 125g ",1.13
"Chips paysannes au sel de Guérande BRET'S, sachet de 250g ",0.81
"Chips à l'ancienne nature LAY'S, paquet de 150g ",0.71
"Chips finement salées LAY'S, 300g ",
"Chips saveur sel & vinaigre, sachet de 130g ",0.91
"Chips paysannes LAY'S, 150g ",1.31
"Chips la classique nature VICO, 270g ",2.02
"Chips ondulées au vinaigre BRET'S, sachet de 125g ",1.92
"Chips nature la généreuse BRET'S, sachet de 125g ",0.99
"Chips recette méditerranéenne au sel LAY'S, sachet de 130g ",0.9
"Chips de pomme de terre et au sel de mer kettle cooked VICO, sachet de120g ",
"Chips goût poulet braisé BRET'S, paquet de 125g ",1.51
"Chips sel LAY'S, 150g ",1.61
"Chips classique salée VICO, sachet de 135g ",1.28
"Chips à l'ancienne LAY'S, sachet de 300g ",0.83
"Chips à l'ancienne LAY'S, paquet de 6x27,5g ",
"Chips super craquante saveur chèvre piment d'Espelette BRET'S, paquetde 125g ",2.14
"Chips à l'ancienne au sel de Guérande BRET'S, 250g ",1.09
"Purée nature U, boîte de 500g ",
"Puree nature U BIO, 2 boîtes de 125g ",1.84
"Purée à l'ancienne crème et pointe de noix de muscade MOUSLINE, 4x125g ",1.08
"Purée de pomme de terre en flocons crème et noix de muscade MOUSLINE,3x65g, 195g ",1.97
"MOUSLINE, produit nature, 3x65g soit 195g ",1.42
"Purée nature Maggi MOUSLINE, 4 étuis de 130g, 520g ",1.1
"Purée nature bio MOUSLINE, 2x100g, soit 200g ",1.8
"Riz long précuit 2mn UNCLE BEN'S, pochon de 250g ",1.27
"Riz basmati nature micro-ondable 2 minutes U, sachet de 250g ",1.47
"Riz complet méditerranéenne 2min. UNCLE BEN'S micro ondable, 250g ",1.66
"Riz micro ondable 2mn basmati UNCLE BEN'S, pochon de 250g ",1.48
"Riz à la méditerranéenne 2min. bio UNCLE BEN'S, pochon 240g ",1.11
"Riz express 2mn tomate&huile d'olive UNCLE BEN'S, pochon de 250g ",1.21
"Riz et Lentilles aux carottes 2min UNCLE BENS, micro-ondable de 220g ",1.02
"Riz micro ondable 2mn cantonais UNCLE BEN'S, pochon de 250g ",2.13
"Riz basmati 2min. bio UNCLE BEN'S, pochon 240g ",1.29
"Riz micro ondable 2mn saveur méditerranéenne UNCLE BEN'S, pochon de 250g ",1.17
"Riz express 2mn façon paëlla UNCLE BEN'S, pochon de 250g ",1.94
"Riz express 2mn citron&romarin UNCLE BEN'S, pochon de 250g ",1.27
"Riz express 2mn aux champignons UNCLE BEN'S, pochon de 250g ",
"Coquillette nature micro-ondable 2 minutes U, paquet de 200g ",2.66
"Pâtes banzaï noodle saveur poulet épicé LUSTUCRU, cup de 60g ",1.78
"Pâtes banzai noodle saveur curry LUSTUCRU, cup de 60g ",1.58
"Pâtes banzai noodle saveur poulet LUSTUCRU, cup de 60g ",
