name,price
Boisson gazéfiée saveur cola avec sucre et édulcorant U Pet 2L ,0.86
"Boisson gazéifiée saveur cola avec édulcorant 1,5L ",0.73
"Soda cola zéro U, 6 canettes de 33cl ",1.69
"COLA zéro sans sucre, 1,5L ",0.6
Boisson gazéifiée saveur cola avec sucre et édulcorant 1L ,0.51
Boisson gazéifiée saveur cola et cerise avec sucre et édulcorant ,0.91
"Boisson gazéifiée saveur cola avec édulcorant, 1L ",0.55
"Cola regular U, 6x33cl ",1.72
"Cola Transparent édition limitée U, 1l ",0.51
"PEPSI Max, 1,5l ",1.05
"COCA COLA, 8 mini canettes de 15cl ",3.14
"COCA-COLA, 4 bouteilles en plastique de 50cl ",3.22
"COCA-COLA, bouteille en plastique de 1,75l ",1.78
"COCA-COLA zero sans caféine, bouteille de 1,25l ",
"COCA COLA zéro, 6x1,25L ",7.5
"COCA-COLA zéro lemon, bouteille en plastique de 1,25l ",
"PEPSI Max, 6 canettes de 33cl ",2.32
"Cola ELSASS, boite aluminium 6 bouteilles de 33cl ",2.5
"Cola regular PEPSI, 1,5l ",0.86
"COCA-COLA Zéro, 4x50cl ",0.73
"COCA-COLA, bouteille en plastique 6x1,25l ",1.69
"COCA-COLA light, bouteille en plastique de 1,25L ",0.6
"COCA COLA light, 8x25cl ",0.51
"COCA COLA cherry, bouteille en plastique de 1,25litre ",0.91
"COCA-COLA, 10 canettes de 33cl ",0.55
"COCA-COLA zéro, 6x33cl ",1.72
"COCA COLA régular, 8 bouteilles de verre de 20cl ",0.51
"Cola ELSASS, 6 bouteilles de 50cl ",1.05
"Cola regular PEPSI, bouteille de 1l ",3.14
"DR PEPPER, 6 canettes de 33cl ",3.22
"PEPSI Max, bouteille de 1l ",1.78
"COCA COLA zéro, 8 mini canettes de 15cl ",
"COCA-COLA, 6 boîtes de 33cl ",7.5
"COCA-COLA cherry, 6 boites de 33cl ",
"PEPSI Cola Regular, 6 canettes de 33cl ",2.32
"Cola ELSASS, bouteille de 1,25l ",2.5
"COCA COLA vanille, bouteille en plastique de 1,25litre ",1.16
"Cola puma, bouteille de 1,5l ",2.8
"Boisson gazifiée aromatisée agrumes avec édulcorant 1,5L ",8.58
"Boisson gazéifiée aux extraits de fruits aromatisée 1,5L ",
"Diabolo menthe U, bouteille en plastique de 1,5L ",4.0
"Soda saveur agrumes, 1,5l ",1.64
"Boisson gazifiée au jus d'orange à base de concentré avec sucre etédulcorant 1,5L ",5.05
"Boisson gaziéfiée au jus de citron à base de concentré avec sucre etédulcorant 1,5L ",2.58
"Boisson gazéifiée citron, citron vert et menthe avec sucre et édulcorant, 1,5L ",
"Boisson gazeuse arômatisée jus d'orange et orange sanguine SAN PELLEGRINO, 6x33cl ",3.95
"Agrum SCHWEPPES, bouteille en plastique de 1,5 litre ",0.99
"Orange FANTA, bouteille de 1,5l ",4.05
"PULCO fines bulles citron citron vert, 1l ",0.99
"SCHWEPPES agrum', bouteille de 1l ",3.02
"SCHWEPPES, lemon slim can 6x33cl ",2.88
"SCHWEPPES agrum zéro, bouteille de 1,5l ",3.1
"Mojito SCHWEPPES, 6 canettes slim de 33cl ",2.4
"FANTA Orange, bouteille de 1l ",1.15
"Boisson gazeuse aromat.jus orange ABC SAN PELLEGRINO, ARANCIATA, 6X33cl ",
"RICQLES menthe, 8x25cl ",0.43
"SCHWEPPES, agrum zéro slim can 6x33cl ",0.86
"PULCO fines bulles saveur citron, bouteille de 1l ",1.05
"FANTA Citron frappé, 1,5L ",1.05
"Soda au citron KAS, bouteille de 1,5l ",
"Boisson gazeuse aromatisée jus de citron et menthe SAN PELLEGRINO, 6x33cl ",0.82
"Boisson gazeuse arômatisée au jus de citron SAN PELLEGRINO, 6x33cl ",
"Schweppes lemon zéro, bouteille de 1,5l ",0.98
"SCHWEPPES, agrum slim can 6x33cl ",
"FANTA orange, 6x33cl ",1.53
"SCHWEPPES mojito, bouteille de 1l ",1.35
"SCHWEPPES Lemon, 1,5 litre ",1.72
"SCHWEPPES agrumes,  4 bouteilles de 50cl ",
"SCHWEPPES agrum, pack boîtes de 12x15cl ",
"PULCO fines bulles saveur citron menthe, bouteille de 1l ",1.46
"Pulpé orange puma, bouteille de 1,5l ",
"Boisson gazéifiée au jus d'orange pulpé à base de concentré avec sucre1,5L ",
"Boisson gazéifiée au jus d'orange pulpé à base de concentré avecédulcorant 1,5L ",3.3
"Boisson gazifiée aux jus d'oranges pulpés à base de concentrés avecsucre et édulcorant 1,5L ",4.8
"ORANGINA standard, bouteille de 1l ",2.98
"ORANGINA standard, slim cannette 6x33cl ",1.7
"ORANGINA light, bouteille de 1l ",1.39
"ORANGINA, bouteille en plastique de 1,5l ",
"ORANGINA, 12 canettes de 15cl ",3.35
ORANGINA light slim boîte 6x33cl ,
"SEVEN UP Lemon citron, bouteille de 1,25l ",1.47
"Boisson gazeuse à l'eau de source pomme et poire, POM'DE LISBETH, bouteille de 1,25l ",3.0
"ORANGINA Rouge orange sanguine, bouteille de 1,5l ",2.54
"Boisson gazeuse à l'eau de source pomme et poire POM'DE LISBETH, 6 bouteilles de 33cl ",
"ORANGINA, 8 bouteilles de 25cl ",
"ORANGINA, 4 bouteilles de 50cl ",3.4
"Orangina light pet 1,5 litre ",4.5
"ORANGINA, 6 bouteilles de 25cl ",1.7
"ORANGINA standard à la pulpe d'orange, bouteille de 2 litres ",0.67
"Limonade U, 6 bouteilles de 33cl ",1.05
"Limonade U PET, 6x1,5L ",0.99
"Limonde zéro sans sucre U, 1,5l ",1.1
"Limonade U BIO, bouteille de 1l ",1.36
"Limonade à l'ancienne Saveurs U, bouteille en verre de 1l ",2.95
"Limonade zéro LORINA, 1,5l ",1.45
"Limonade double zest LORINA, bouteille de 1,5l ",1.54
"Limonande LINESS, bouteille de 1,25l ",4.35
"Agrumade artisanale bio LORINA, bouteille en plastique de 1,25cl ",
"Limonade artisanale LORINA, bouteille de 1l ",
"Limonade cristal LORINA, 1,25l ",1.21
"Limonade Bio LINESS, bouteille en verre de 75cl ",1.76
"Limonade bio ""Recette Authentique"" LORINA, 1,25l ",2.98
"Limonade LINESS, 6x33cl ",
"Limonade MIXMI, bouteille en verre de 1l ",3.15
"Orangeade artisanale bio LORINA, bouteille en plastique de 1,25cl ",1.5
"Limonade puma, bouteille de 1,5 litre ",3.18
"Tonic zero U PET, 1,50L ",1.99
"Tonic U, 6 bouteille de 33cl ",2.29
"Tonic U PET, 1,50L ",0.83
"Indian Tonic SCHWEPPES, 8x25cl ",
"SCHWEPPES, Indian tonic zéro slim can 6x33cl ",
"SCHWEPPES, Indian Tonic slim can 6x33cl ",3.2
"CANADA DRY Ginger Ale, 6x33cl ",
"GINI Lemon, 6 canettes de 33cl ",3.05
"SCHWEPPES indian tonic, 4 bouteilles de 50cl ",3.45
"SCHWEPPES Indian Tonic, bouteille de 1,5l ",
"SCHWEPPES Indian Tonic zero, 1,5l ",1.5
"GINI, bouteille de 1,5l ",
"CANADA DRY, bouteille de 1,5l ",1.6
"SCHWEPPES Indian Tonic, 12 boîtes de 15cl ",4.45
"Boisson gazéifiée à l'extrait de citron et de citron vert avec sucreet édulcorant 1,5L ",0.77
"Soda saveur mojito U, 6 canettes de 33cl ",2.29
"SPRITE, bouteille en plastique de 1,25l ",
"Zéro SEVEN UP, bouteille de 1,5l ",
"Boisson rafraîchissante au thé vert RIVELLA Vert, bouteille en plastique de 1l ",1.4
"SPRITE faible en sucres, 6 canettes de 33cl ",
"SEVEN UP, boîte de 6x33cl ",0.83
"SEVEN UP zéro, boîtes 6x33cl ",
"Boisson rafraîchissante sans sucre RIVELLA Bleue, bouteille en plastique de 1l ",
"SEVEN UP mojito free, bouteille de 1,5l ",3.2
"Limonade RIVELLA Original, 6 bouteilles de 50cl ",
"SEVEN UP, bouteille de 1L ",3.05
"SEVEN UP mojito, 6 boîtes de 33cl ",3.45
"Boisson rafraîchissante RIVELLA, bouteille en plastique 1 litre ",
"SEVEN UP Zéro, bouteille en plastique de 1litre ",1.5
"SEVEN UP mojito bouteille de 1,5 litre ",
"SEVEN UP, bouteille de 1,5l ",1.6
"Boisson rafraîchissante RIVELLA Rouge, bouteille de 1l ",4.45
"SPRITE profitez-en pet 1,25 litre ",0.77
"Boisson énergisante mango loco MONSTER, 50cl ",2.29
"Boisson énergisante blue edition RED BULL, boîte de 25cl ",
"Energy sans sucres COCA COLA, 25cl ",
"Boisson énergisante Ripper MONSTER, canette de 50cl ",1.4
"Energy DARK DOG, bouteille de 1l ",
"Boisson énergisante à la taurine DARK DOG, canette de 50cl ",2.15
"Boisson énergisante MONSTER ENERGY, 4 boites de 50cl ",2.25
"Boisson énergisante MONSTER ENERGY, boite de 50cl ",1.4
"Boisson énergisante regular RED BULL, 25cl ",
"Boisson énergisante à la taurine blue moon goût de baies et menthe DARK DOG, bouteille de 1l ",5.7
"Boisson énergisante à la taurine, RED BULL, 4 canettes de 35,5cl ",
"Boisson énergisante RED BULL, 4x25cl ",2.5
"Boisson énergisante punch MONSTER, canette de 50cl ",1.4
"Boisson énergisante energy drink RED BULL, boîte de 47,3cl ",1.0
"Energy original COCA COLA, 25cl ",1.3
"Boisson énergisante à la taurine orange spritz DARK DOG, bouteille de1l ",1.05
"Boisson énergisante à la taurine DARK DOG, canette de 25cl ",1.4
"Boisson énergisante energy drink RED BULL, canette de 35,5cl ",1.35
"Boisson énergisante ultra zéro MONSTER, canette de 50cl ",1.5
"Boisson énergisante à la taurine purple party DARK DOG, bouteille de 1l ",1.5
"Boisson énergisante MONSTER ENERGY, canette de 553ml ",1.2
"Boisson énergisante sans sucre RED BULL, 4 bouteilles de 25cl ",1.35
"Boisson énergisante SPRING UP classic, bouteille de 1l ",
"Boisson énergisante gazeuse spring up classic, 6 canettes de 25cl ",1.69
"Energy Drink, boîte de 50cl ",4.22
"Boisson énergisante classic SPRING UP, boîte de 25cl ",1.05
"Boisson aromatisée red spring up, canette de 25cl ",1.1
