name,price
"Salade Chinoise mélange de légumes variés en saumure U, 190g ",
"Champignons noirs déshydratés U, paquet de 50g ",2.19
"Vermicelles de riz U, 250g ",1.69
"Nouilles cuisinées cup aux fruits de mer U, paquet de 70g ",1.39
"Sauce nuoc mam U, 150ml ",0.95
"Litchis au sirop léger U, boîte de 250g ",2.65
"Nouilles cuisinées cup saveur poulet U, 70g ",1.39
"Purée de piment U, 95g ",0.89
"Nouilles cuisinées cup légumes U, boîte de 70g ",1.39
"Galettes de riz U, 100g ",
"Mini épis de maïs U, 190g ",1.79
"Sauce soja sucrée U, 150ml ",1.03
"Sauce soja U, 150ml ",
"Nouilles cuisinées cup saveur boeuf U, 70g ",1.39
"Sauce nems U, 150ml ",0.97
"Nouilles cup cuisinées saveur curry U, 70g ",1.39
"Lait de coco U, 200ml ",
"Vermicelles asiatiques U, 80g ",
"Nouilles en nids U, sachet de 250g ",
"Chips aux crevettes saveur curry thaï U, sachet de 50g ",2.19
"Chips aux crevettes saveur sweet chili U, sachet de 50g ",1.69
"Chips à la crevette U, 50g ",1.39
"Pousses de haricots mungo Asie U, bocal de 37cl ",0.95
"Nouilles sautées classiques NISSIN,  soba cup de 90g ",2.65
"Sauce soja sucrée SUZI WAN, 300ml ",1.39
"Algues nori pour sushi OISHIYA, 10 feuilles soit 28g ",0.89
"Soupe de nouilles arôme boeuf YUM YUM, sachet de 60g ",1.39
"Sauce soja SUZI WAN, 300ml ",
"Nouilles japonaises crevettes hamayaki NISSIN, 63g ",1.79
"Crème de coco SUZI WAN, brique de 200ml ",1.03
"Pois vert au wasabi OISHIYA, 140g ",
Nouilles Japonaises au curry NISSIN 67g ,1.39
"Sauce aigre douce SUZI WAN, 330g ",0.97
"Nouilles ramen soja caramel, KOREAN FOOD STYLE, sachet de 170g ",1.39
"Sauce aigre douce MONT ASIE, 330g ",
"Lait de coco SUZI WAN, brique de 500ml ",
"Sauce pour nems SUZI WAN, 300ml ",1.09
"Soupe nouilles poulet grillé YUMYUM, 70G ",0.7
Nouilles Japonaises Poulet Gingembre NISSIN 63g ,0.7
"Gingembre pour sushi OISHIYA, 110g ",0.56
"Pâte de curry doux PATAK'S, 165g ",
"Nouilles ramen boeuf, KOREAN FOOD STYLE, sachet de 170g ",
"Sauce soja sucrée KIKKOMAN, flacon de 150ml ",
"Nouilles yakitori poulet, NISSIN,  soba cup de 89g ",
"Sauce soja à teneur réduite en sel KIKKOMAN, carafe de 150ml ",0.42
"Lait de coco SUZI WAN, brique de 200ml ",
"Nougat mou vietnamien ONG XEN, 250g ",1.75
"Riz parfumé THAI EXPERT, 1kg ",1.15
"Sauce de piments pour volailles MONT ASIE, flacon de 330g ",
"Riz pour sushi Oishii Yamato OISHIYA, 1kg ",1.8
"Pâte de wasabi OISHIYA, tube de 43g ",
"Légumes Chop Suey SUZI WAN, 195g ",1.73
"Vermicelles de haricots mungo SUZI-WAN, paquet de 100g ",
"Nouilles soba teriyaki NISSIN, sachet de 110g ",2.59
"Pousses de bambou SUZI WAN, bocal de 100g ",2.25
"Crème de coco têtra KARA, pack de 400ml ",2.94
"Sauce pour nems SUZI WAN, flacon de 125ml ",
"Soupe de nouilles arôme poulet YUM YUM, sachet de 60g ",
"Vinaigre de riz OISHIYA, 150ml ",1.68
"Kit sushi et maki pour 4 personnes OISHIYA, 380g ",
"Nouilles sautées teriaki NISSIN,  soba cup de 90g ",2.51
"Soupe de nouilles arôme crevettes YUM YUM, sachet de 60g ",
"Lait de noix de coco KARA, brique de 500ml ",3.1
"Vermicelles de riz Mie Hoen SUZI WAN, 250g ",
"Chips aux crevettes SUZI WAN, 50g ",1.09
"Soupe de nouilles arôme curry YUM YUM, sachet de 60g ",0.4
"Lait de coco KARA, 200ml ",1.17
"Lait de coco THAÏ EXPERT, 200ml ",1.12
"Gingembre confit MONT ASIE, sachet de 100g ",2.4
"Nouilles chinoises MONT ASIE, sachet de 250g ",
"Sauce d'huîtres MONT ASIE, 330g ",1.67
"Huile de sésame MONT ASIE, 150ml ",
"Crème de noix de coco Indonésie KARA, brique de 200ml ",2.25
"Sauce soja KIKKOMAN, bouteille de 150ml ",2.94
"Sauce de soja MONT ASIE, 500ml ",
Nouilles Japonaises boeuf 5 épices NISSIN 64g ,
"Sauce de piment sriracha MONT ASIE, 180ml ",1.68
"Nouilles en nid SUZI WAN, sachet de 250g ",
"Sauce Soja sucrée SUZI WAN, flacon de 125ml ",2.51
"Nouilles soba classique NISSIN, sachet de 109g ",
"Nouilles sukiyaki boeuf NISSIN, soba cup de 90g ",3.1
"Sauce nuoc mam SUZI-WAN, flacon de 125ml ",
"Sauce soja MONT ASIE, 150ml ",1.09
"Sauce soja salé KIKKOMAN, carafe de 150ml ",0.4
"Lait de coco light SUZI WAN, brique de 200ml ",1.17
"Crème de coco SUZI WAN, 500ml ",1.12
"Cacahuètes au wasabi OISHIYA, boîte de 100g ",2.4
"Soupe de nouilles arôme légumes YUM YUM, sachet de 60g ",
"Soupe de nouilles arôme canard YUM YUM, sachet de 60g ",1.67
"Pâte de curry rouge THAÏ EXPERT, 110g ",
"Sauce Yakitoti ""Cuisine au Wok "" KIKKOMAN, flacon de 250ml ",1.63
"Nouilles sautées canard NISSIN,  soba cup de 87g ",2.95
"Sauce soja sucrée KIKKOMAN, 250ml ",
"Pâte de curry vert THAÏ EXPERT, 110g ",1.82
"Sauce soja allégée en sel SUZI WAN, flacon de 125ml ",1.43
"Burrito kit U, 510g ",
"Wraps souples U, paquet de 370g ",
"Tortillas chips goût salé U, sachet de 300g ",
"Sauce chaude pour Fajitas U, 430g ",2.59
"Guacamole U, 300g ",1.17
"Mélanges épices pour fajitas U, sachet 30g ",0.96
"Tortillas chips chili U, 300g ",
"Sauce salsa forte U, bocal de 315g ",1.65
"Tortillas souples de maïs U, 8 paquets soit 320g ",2.97
"Salsa sauce médium U, 315g ",3.32
"Salsa sauce douce sans piment U, 315g ",0.41
"Fajita Kit U, 505g ",0.43
"Tortillas souples blé U, 8 paquets soit 320g ",1.38
"Mélanges épices pour guacamole U, sachet de 20g ",4.79
"Wraps au blé complet MISSION, 370g ",2.59
"Tortillas sans gluten OLD EL PASO, 216g ",4.37
"Kit barquitas OLD EL PASO, paquet de 345g ",
"Kit burrito sans piment OLD EL PASO, 491g ",
"Sauce à cuisiner pour fajitas sans piment OLD EL PASO, 395g ",3.39
"Sauce Salsa dip douce OLD EL PASO, bocal de 312g ",
"Kit pour fajitas tomates et poivrons OLD EL PASO, 500g ",2.29
"Sauce Fajita OLD EL PASO, bocal de 395g ",2.27
"Kit pour crousti fajitas sans piment OLD EL PASO, paquet de 521g ",1.48
"Tortillas de blé OLD EL PASO, 8 unités soit 326g ",1.16
"Sauce guacamole OLD EL PASO, bocal de 320g ",2.14
"Mélange d'epices pour fajitas mix OLD EL PASO, sachet de 30g ",1.28
"Sauce salsa thick chunky OLD EL PASO, 226g ",1.84
"Mini barquitas de blé nature OLD EL PASO, boîte de 145g ",1.39
"Wraps multigrains graines de lin MISSION, 370g ",1.28
"Wraps au blé nature MISSION, 370g ",3.91
"Tortilla chips bowls OLD EL PASO, 150g ",1.85
"Mélange d'épices pour Guacamole OLD EL PASO, sachet de 20g ",1.15
"Tortillas de maïs souples OLD EL PASO, 8 sachets de 335g ",2.39
"Kit fajitas aux épices douces sans piment OLD EL PASO, 478g ",3.25
"Kit barquitas sans piment OLD EL PASO, paquet de 329g ",5.56
"Wraps au blé complet OLD EL PASO, paquet de 350g ",5.92
"Kit pour Burritos Original OLD EL PASO, paquet de 510g ",2.62
"Wraps de blé souples OLD EL PASO, 6 unités soit 350g ",2.28
"Chips crunchy tortillas chili OLD EL PASO, sachet de 185g ",5.45
"Tortilla chips paprika OLD EL PASO, sachet de 185g ",2.47
"Chips crunchy tortillas fajita OLD EL PASO, sachet de 185g ",5.6
"Chips crunchy nachips OLD EL PASO, sachet de 185g ",
"Kit pour enchiladas OLD EL PASO, paquet de 657g ",1.99
"Mélange d'épices pour burritos OLD EL PASO, 40g ",
"Sauces Salsa trio dip OLD EL PASO, 575g ",2.58
"Kit fajitas barbecue original OLD EL PASO, paquet de 500g ",
"Tortilla strips crunchy original OLD EL PASO, 185g ",2.03
"Sauce tikka masala hot spicy, PATAK'S, bocal de 350g ",
"Sauce peanuts and coconut, PATAK'S, bocal de 350g ",2.75
"Sauce Tikka Masala mild PATAK'S, bocal de 350g ",1.24
"Pâte de curry au gingembre, 210g ",2.35
"Sauce Tandoori PATAK'S, 350g ",4.75
"Sauce Korma PATAK'S, bocal de 350g ",5.55
